[
  {
    "version": "evaluation_case.v1",
    "case_id": "MEM-01",
    "domain": "MEMORY",
    "provenance_type": "BUSINESS_ABSTRACTED",
    "query": "对 Customer-A 的项目生成视觉参考：客户偏好深色影调，上下文是否命中该偏好？",
    "expected": {
      "memory_ids": ["mem_6efea88b7660b39e"],
      "memory_required": true
    },
    "fixture": {
      "memory_setup": {
        "project_id": "proj_a_101",
        "customer_id": "cust_a_001",
        "records": [
          {
            "subject_type": "CUSTOMER",
            "subject_id": "cust_a_001",
            "memory_type": "PREFERENCE",
            "content": "客户偏好：新中式风格、偏深色影调，避免过度磨皮（保留皮肤自然质感）。",
            "source_type": "HUMAN_REVIEW",
            "source_ref": "case_0001",
            "evidence_refs": [{ "kind": "REVIEW_CASE", "ref": "case_0001" }],
            "confidence": 1
          }
        ]
      }
    },
    "source": { "source_id": "GS-01", "source_type": "KB_SNAPSHOT_SCENARIO", "generated_or_manual": "MANUAL" },
    "tags": ["correct-memory-use", "positive"],
    "review_status": "SYSTEM_REVIEWED",
    "synthetic": false
  },
  {
    "version": "evaluation_case.v1",
    "case_id": "MEM-02",
    "domain": "MEMORY",
    "provenance_type": "BUSINESS_ABSTRACTED",
    "query": "同一项目同时存在 CUSTOMER 偏好与 PROJECT 决策记忆，上下文是否同时装配并按契约确定性排序？",
    "expected": {
      "memory_ids": ["mem_2c7c72d9f99fa0e4", "mem_6efea88b7660b39e"],
      "memory_required": true
    },
    "fixture": {
      "memory_setup": {
        "project_id": "proj_a_101",
        "customer_id": "cust_a_001",
        "records": [
          {
            "subject_type": "CUSTOMER",
            "subject_id": "cust_a_001",
            "memory_type": "PREFERENCE",
            "content": "客户偏好：新中式风格、偏深色影调，避免过度磨皮（保留皮肤自然质感）。",
            "source_type": "HUMAN_REVIEW",
            "source_ref": "case_0001",
            "evidence_refs": [{ "kind": "REVIEW_CASE", "ref": "case_0001" }],
            "confidence": 1
          },
          {
            "subject_type": "PROJECT",
            "subject_id": "proj_a_101",
            "memory_type": "DECISION",
            "content": "项目方案：采用龙井茶园外景与自然光拍摄。",
            "source_type": "HUMAN_REVIEW",
            "source_ref": "case_0002",
            "evidence_refs": [{ "kind": "REVIEW_CASE", "ref": "case_0002" }],
            "confidence": 1
          }
        ]
      }
    },
    "source": { "source_id": "GS-02", "source_type": "KB_SNAPSHOT_SCENARIO", "generated_or_manual": "MANUAL" },
    "tags": ["multiple-relevant-memories", "deterministic-order"],
    "review_status": "SYSTEM_REVIEWED",
    "synthetic": false
  },
  {
    "version": "evaluation_case.v1",
    "case_id": "MEM-03",
    "domain": "MEMORY",
    "provenance_type": "ADVERSARIAL",
    "query": "另一个项目的 PROJECT 级记忆是否会泄漏进当前项目上下文？",
    "expected": {
      "memory_ids": ["mem_2c7c72d9f99fa0e4"],
      "forbidden_memory_ids": ["mem_67a30b58cacc7459"],
      "memory_required": true
    },
    "fixture": {
      "memory_setup": {
        "project_id": "proj_a_101",
        "customer_id": "cust_a_001",
        "records": [
          {
            "subject_type": "PROJECT",
            "subject_id": "proj_a_101",
            "memory_type": "DECISION",
            "content": "项目方案：采用龙井茶园外景与自然光拍摄。",
            "source_type": "HUMAN_REVIEW",
            "source_ref": "case_0002",
            "evidence_refs": [{ "kind": "REVIEW_CASE", "ref": "case_0002" }],
            "confidence": 1
          },
          {
            "subject_type": "PROJECT",
            "subject_id": "proj_b_202",
            "memory_type": "DECISION",
            "content": "项目方案：采用西湖周边外景与古典江南风格。",
            "source_type": "HUMAN_REVIEW",
            "source_ref": "case_0003",
            "evidence_refs": [{ "kind": "REVIEW_CASE", "ref": "case_0003" }],
            "confidence": 1
          }
        ]
      }
    },
    "source": { "source_id": "GS-03", "source_type": "KB_SNAPSHOT_SCENARIO", "generated_or_manual": "MANUAL" },
    "tags": ["irrelevant-memory", "cross-project-contamination"],
    "review_status": "SYSTEM_REVIEWED",
    "synthetic": true
  },
  {
    "version": "evaluation_case.v1",
    "case_id": "MEM-04",
    "domain": "MEMORY",
    "provenance_type": "ADVERSARIAL",
    "query": "跨客户隔离：Customer-B 的偏好是否可能出现在 Customer-A 的项目上下文中？",
    "expected": {
      "memory_ids": ["mem_6efea88b7660b39e"],
      "forbidden_memory_ids": ["mem_13c6901f6187ed94"],
      "memory_required": true
    },
    "fixture": {
      "memory_setup": {
        "project_id": "proj_a_101",
        "customer_id": "cust_a_001",
        "records": [
          {
            "subject_type": "CUSTOMER",
            "subject_id": "cust_a_001",
            "memory_type": "PREFERENCE",
            "content": "客户偏好：新中式风格、偏深色影调，避免过度磨皮（保留皮肤自然质感）。",
            "source_type": "HUMAN_REVIEW",
            "source_ref": "case_0001",
            "evidence_refs": [{ "kind": "REVIEW_CASE", "ref": "case_0001" }],
            "confidence": 1
          },
          {
            "subject_type": "CUSTOMER",
            "subject_id": "cust_b_002",
            "memory_type": "PREFERENCE",
            "content": "客户偏好：婚纱套系、偏好自然光与柔和影调，注重情绪表达。",
            "source_type": "HUMAN_REVIEW",
            "source_ref": "case_0004",
            "evidence_refs": [{ "kind": "REVIEW_CASE", "ref": "case_0004" }],
            "confidence": 1
          }
        ]
      }
    },
    "source": { "source_id": "GS-04", "source_type": "KB_SNAPSHOT_SCENARIO", "generated_or_manual": "MANUAL" },
    "tags": ["cross-customer-contamination", "scope-isolation"],
    "review_status": "SYSTEM_REVIEWED",
    "synthetic": true
  },
  {
    "version": "evaluation_case.v1",
    "case_id": "MEM-05",
    "domain": "MEMORY",
    "provenance_type": "SYNTHETIC",
    "query": "匿名线索转化项目（无 customer_id）：上下文是否只含 PROJECT 级记忆，不回退取任意客户记忆？",
    "expected": {
      "memory_ids": ["mem_2c7c72d9f99fa0e4"],
      "forbidden_memory_ids": ["mem_6efea88b7660b39e"],
      "memory_required": true
    },
    "fixture": {
      "memory_setup": {
        "project_id": "proj_a_101",
        "customer_id": null,
        "records": [
          {
            "subject_type": "PROJECT",
            "subject_id": "proj_a_101",
            "memory_type": "DECISION",
            "content": "项目方案：采用龙井茶园外景与自然光拍摄。",
            "source_type": "HUMAN_REVIEW",
            "source_ref": "case_0002",
            "evidence_refs": [{ "kind": "REVIEW_CASE", "ref": "case_0002" }],
            "confidence": 1
          },
          {
            "subject_type": "CUSTOMER",
            "subject_id": "cust_a_001",
            "memory_type": "PREFERENCE",
            "content": "客户偏好：新中式风格、偏深色影调，避免过度磨皮（保留皮肤自然质感）。",
            "source_type": "HUMAN_REVIEW",
            "source_ref": "case_0001",
            "evidence_refs": [{ "kind": "REVIEW_CASE", "ref": "case_0001" }],
            "confidence": 1
          }
        ]
      }
    },
    "source": { "source_id": "GS-05", "source_type": "KB_SNAPSHOT_SCENARIO", "generated_or_manual": "MANUAL" },
    "tags": ["no-customer-fallback", "scope-isolation"],
    "review_status": "SYSTEM_REVIEWED",
    "synthetic": true
  },
  {
    "version": "evaluation_case.v1",
    "case_id": "MEM-06",
    "domain": "MEMORY",
    "provenance_type": "SYNTHETIC",
    "query": "偏好被 SUPERSEDE（旧「偏明亮」→ 新「偏深色」）：旧版本是否不再进入上下文，新版本是否生效？",
    "expected": {
      "memory_ids": ["mem_ab1655cbf2a22abd"],
      "forbidden_memory_ids": ["mem_cae51158ede29848"],
      "memory_required": true
    },
    "fixture": {
      "memory_setup": {
        "project_id": "proj_a_101",
        "customer_id": "cust_a_001",
        "records": [
          {
            "subject_type": "CUSTOMER",
            "subject_id": "cust_a_001",
            "memory_type": "PREFERENCE",
            "content": "客户偏好：偏明亮色调。",
            "source_type": "HUMAN_REVIEW",
            "source_ref": "case_0005",
            "evidence_refs": [{ "kind": "REVIEW_CASE", "ref": "case_0005" }],
            "confidence": 1
          }
        ],
        "actions": [
          {
            "op": "supersede",
            "memory_id": "mem_cae51158ede29848",
            "input": {
              "subject_type": "CUSTOMER",
              "subject_id": "cust_a_001",
              "memory_type": "PREFERENCE",
              "content": "客户偏好：偏深色影调。",
              "source_type": "HUMAN_REVIEW",
              "source_ref": "case_0006",
              "evidence_refs": [{ "kind": "REVIEW_CASE", "ref": "case_0006" }],
              "confidence": 1
            }
          }
        ]
      }
    },
    "source": { "source_id": "GS-06", "source_type": "KB_SNAPSHOT_SCENARIO", "generated_or_manual": "MANUAL" },
    "tags": ["stale-memory", "supersede-lifecycle", "active-only"],
    "review_status": "SYSTEM_REVIEWED",
    "synthetic": true
  },
  {
    "version": "evaluation_case.v1",
    "case_id": "MEM-07",
    "domain": "MEMORY",
    "provenance_type": "SYNTHETIC",
    "query": "记忆被 INVALIDATED（客户改口）：是否不进入上下文且保留 invalidation_reason？",
    "expected": {
      "memory_ids": [],
      "memory_required": false,
      "expect_count": 0,
      "expect_truncated": false
    },
    "fixture": {
      "memory_setup": {
        "project_id": "proj_a_101",
        "customer_id": "cust_a_001",
        "records": [
          {
            "subject_type": "CUSTOMER",
            "subject_id": "cust_a_001",
            "memory_type": "PREFERENCE",
            "content": "客户偏好：偏明亮色调。",
            "source_type": "HUMAN_REVIEW",
            "source_ref": "case_0005",
            "evidence_refs": [{ "kind": "REVIEW_CASE", "ref": "case_0005" }],
            "confidence": 1
          }
        ],
        "actions": [
          { "op": "invalidate", "memory_id": "mem_cae51158ede29848", "reason": "客户改口，偏好更新为偏深色影调" }
        ]
      }
    },
    "source": { "source_id": "GS-07", "source_type": "KB_SNAPSHOT_SCENARIO", "generated_or_manual": "MANUAL" },
    "tags": ["invalidate-lifecycle", "active-only"],